BEGIN_YEARMONTH,BEGIN_DAY,BEGIN_TIME,END_YEARMONTH,END_DAY,END_TIME,EPISODE_ID,EVENT_ID,STATE,STATE_FIPS,YEAR,MONTH_NAME,EVENT_TYPE,CZ_TYPE,CZ_FIPS,CZ_NAME,WFO,BEGIN_DATE_TIME,CZ_TIMEZONE,END_DATE_TIME,INJURIES_DIRECT,INJURIES_INDIRECT,DEATHS_DIRECT,DEATHS_INDIRECT,DAMAGE_PROPERTY,DAMAGE_CROPS,SOURCE,EPISODE_NARRATIVE,EVENT_NARRATIVE
200601,1,300,200601,1,1500,203892,5491373,OKLAHOMA,40,2006,January  ,Wildfire,Z,73,PITTSBURG,TSA,2006-01-01 03:00:00,CST,2006-01-01 15:00:00,0,0,0,0,,,NEWSPAPER,A wildfire in rural Pittsburg County to the northeast of McAlester near Bugtussle Road and Two Mile Lane burned hundreds of acres.,
200601,1,900,200601,1,1900,203897,5491378,OKLAHOMA,40,2006,January  ,Wildfire,Z,74,HASKELL,TSA,2006-01-01 09:00:00,CST,2006-01-01 19:00:00,0,0,0,0,,,NEWSPAPER,A wildfire in the Garland Corner area northeast of Stigler burned 200 acres.,
200601,1,900,200601,2,900,203286,5488720,NEW MEXICO,35,2006,January  ,Wildfire,Z,33,CENTRAL LEA COUNTY,MAF,2006-01-01 09:00:00,MST,2006-01-02 09:00:00,3,0,0,0,700K,10K,LAW ENFORCEMENT,,"Record high temperatures (in the mid to upper 70s), very low relative humidities, high winds, and two and a half months without measurable precipitation combined to produce a very active fire weather day.  SPC issued a critical fire weather area for west Texas and southeastern New Mexico in their Day 1 Fire Weather Outlook issued early on January 1st.  

A grass fire driven by wind burned 50,000 acres west of Hobbs on New Year's Day.  The western side of Hobbs had to be evacuated, including the community college, a casino, and several neighborhoods.  Three firefighters sustained minor injuries, but no one was seriously injured.  Four families were provided shelter by the Red Cross, though eleven homes were destroyed.  Two businesses and 10 vehicles also were destroyed by the fire.  

In addition to the wildfire west of Hobbs, two fires burned near Tatum in northern Lea county.  No structures were damaged in these fires, however, U.S. Highway 380 was closed from Roswell to the Texas state line during the day because of the fires.  According to local authorities, one fire near Tatum was caused by fireworks and the other was sparked by a car crash."
200601,1,1045,200601,5,1900,203287,5485922,TEXAS,48,2006,January  ,Wildfire,Z,70,REAGAN,MAF,2006-01-01 10:45:00,CST,2006-01-05 19:00:00,1,0,0,0,15K,1.3M,TRAINED SPOTTER,,"Record high temperatures (in the mid to upper 70s), very low relative humidities, high winds, and two and a half months without measurable precipitation combined to produce a very active fire weather day.  SPC issued a critical fire weather area for west Texas and southeastern New Mexico in their Day 1 Fire Weather Outlook issued early on January 1st.  

A grassfire spread to over 40,000 acres in Reagan and Irion counties on New Year's Day.  Newspapers originally reported the cause as sparks from a transformer.  Later, a fire department official in Big Lake reported that a hawk landed on power lines and burst into flames, starting the fire.  Because of high winds, record high temperatures, and very low relative humidities, it took firefighters 3 days to contain the wildfire.  It was extinguished a couple of days later.  One firefighter sustained 2nd degree burns to his face while fighting the fire but was treated and released from a regional burn center.  The fire was in mostly open country and thus only a hunting cabin was destroyed.    

In addition to the major fire in Reagan and Irion counties, several other small fires scorched west Texas.  Both Ector and Midland counties had fire and fireworks bans in effect for the period between New Year's Eve and January 6, 2006.  Several other counties also had fireworks bans in effect for the New Year's holiday.  

January was a dry month overall.  Several other minor fires occurred throughout west Texas, including two along Interstate 20 in Stanton.  Smoke from one of these fires reduced visibility on Interstate 20, causing a five car pile-up that resulted in two injuries.  Another fire in Scurry county, near the Inadale Cotton Gin, burned 415 modules of cotton, each worth around $3,000.  Each of the modules contains about 10 bales of cotton.

Damage estimates in the above entry include all fires that burned in Texas during the month of January."
200601,1,1055,200601,1,1300,203290,5486115,TEXAS,48,2006,January  ,Wildfire,Z,23,SWISHER,LUB,2006-01-01 10:55:00,CST,2006-01-01 13:00:00,0,0,0,0,175K,0,NEWSPAPER,"
January 1 Wind and Wildfire Event Summary - A potent upper level trough affected much of the Southern Plains on New Year's Day. The trough resulted in widespread high winds over the region, where intense short-term drought conditions existed. The wind combined with the exceptionally dry conditions to result in a historic outbreak of wildfires over eastern New Mexico, Texas, and Oklahoma.

High and frequently severe winds began to blow over the west Texas South Plains by late morning. These winds persisted through the mid afternoon hours, and resulted in widespread blowing dust and one injury. At least a dozen wind-driven wildfires were sparked over the South Plains. Four of the wildfires were significant, and resulted in the loss of property and three injuries. The winds and fires on the 1st combined to result in four injuries and estimated property losses that exceeded $350,000 .","A wildfire near the rural community of Claytonville (Swisher County) destroyed two homes. No injuries were reported.

A second wildfire ignited near the intersection of Regis and Interstate 27, one mile southwest of Lubbock International Airport. The fire destroyed horse stables, and one fire fighter was hospitalized for smoke inhalation related injuries.

Another large wildfire near Levelland burned two mobile homes and injured fire fighters. Two firemen were hospitalized due to minor burn injuries and smoke inhalation.

A wildfire that initiated near Tatum, New Mexico, burned several thousand acres of rangeland and threatened structures as it spread across the Texas/New Mexico state-line into Yoakum County near Bronco. The fire was contained before doing significant damage in Yoakum County, but one rural residence was evacuated."
200601,1,1100,200601,1,1630,203627,5486447,TEXAS,48,2006,January  ,Wildfire,Z,15,WHEELER,AMA,2006-01-01 11:00:00,CST,2006-01-01 16:30:00,0,0,0,0,,,NEWSPAPER,A deepening low pressure system over Kansas...low relative humidities...and dry fuels combined to produce extreme fire danger conditions. A wildfire burned nearly twenty-three thousand acres in the southeast Texas panhandle between Interstate 40 and Clarendon. Several houses were threatened outside Clarendon...however the fire was diverted around them. Another wildfire burned nearly thirty-one hundred acres just northeast of Shamrock. About one hundred people were evacuated by authorities and about ten structures and one motel were threatened by the wildfire. One firefighter on the Howardwick wildfire was injured when he received minor burns to the face.,
200601,1,1100,200601,4,1700,203627,5486446,TEXAS,48,2006,January  ,Wildfire,Z,19,DONLEY,AMA,2006-01-01 11:00:00,CST,2006-01-04 17:00:00,1,0,0,0,,,NEWSPAPER,A deepening low pressure system over Kansas...low relative humidities...and dry fuels combined to produce extreme fire danger conditions. A wildfire burned nearly twenty-three thousand acres in the southeast Texas panhandle between Interstate 40 and Clarendon. Several houses were threatened outside Clarendon...however the fire was diverted around them. Another wildfire burned nearly thirty-one hundred acres just northeast of Shamrock. About one hundred people were evacuated by authorities and about ten structures and one motel were threatened by the wildfire. One firefighter on the Howardwick wildfire was injured when he received minor burns to the face.,
200601,1,1113,200601,2,2300,203872,5486820,TEXAS,48,2006,January  ,Wildfire,Z,64,STERLING,SJT,2006-01-01 11:13:00,CST,2006-01-02 23:00:00,0,0,0,0,,,FIRE DEPT/RESCUE SQUAD,,"The Cole Fire started in southern Sterling County along highway 163 and spread quickly to the east for 15 to 20 miles in winds gusting upwards of 50 mph and humidities of 5 to 10 percent. This fire spread into Tom Green and extreme southwest Coke County. The fire did threaten the community of Water Valley, however was contained. The fire consumed around 40 thousand acres."
200601,1,1200,200601,1,2000,203887,5491487,OKLAHOMA,40,2006,January  ,Wildfire,Z,64,CREEK,TSA,2006-01-01 12:00:00,CST,2006-01-01 20:00:00,0,0,0,0,200K,,NEWSPAPER,"Three fast moving wildfires broke out in the Bristow area burning thousands of acres and many structures including two mobile homes.

Another fire occurred from near the old Shamrock Highway to the northeast near Joseph's Fine Foods and across Highway 16.  The fire charred 10,000 acres but did not damage any homes.",
200601,1,1213,200601,2,2300,203872,5486821,TEXAS,48,2006,January  ,Wildfire,Z,71,IRION,SJT,2006-01-01 12:13:00,CST,2006-01-02 23:00:00,1,0,0,0,,,FIRE DEPT/RESCUE SQUAD,,The Rocker B fire started soon after the Cole fire. This fire started just to the west of the Irion County line and moved quickly to the east with 50 mph wind gusts. One firefighter was injured while fighting this blaze. This fire also consumed about 40 thousand acres of land.
200601,1,1330,200601,1,1500,203290,5486116,TEXAS,48,2006,January  ,Wildfire,Z,35,LUBBOCK,LUB,2006-01-01 13:30:00,CST,2006-01-01 15:00:00,1,0,0,0,50K,0,BROADCAST MEDIA,"
January 1 Wind and Wildfire Event Summary - A potent upper level trough affected much of the Southern Plains on New Year's Day. The trough resulted in widespread high winds over the region, where intense short-term drought conditions existed. The wind combined with the exceptionally dry conditions to result in a historic outbreak of wildfires over eastern New Mexico, Texas, and Oklahoma.

High and frequently severe winds began to blow over the west Texas South Plains by late morning. These winds persisted through the mid afternoon hours, and resulted in widespread blowing dust and one injury. At least a dozen wind-driven wildfires were sparked over the South Plains. Four of the wildfires were significant, and resulted in the loss of property and three injuries. The winds and fires on the 1st combined to result in four injuries and estimated property losses that exceeded $350,000 .","A wildfire ignited near the intersection of Regis and Interstate 27, one mile southwest of Lubbock International Airport. The fire destroyed horse stables, and one fire fighter was hospitalized for smoke inhalation related injuries."
200601,1,1430,200601,1,1600,203290,5486117,TEXAS,48,2006,January  ,Wildfire,Z,34,HOCKLEY,LUB,2006-01-01 14:30:00,CST,2006-01-01 16:00:00,2,0,0,0,100K,0,NEWSPAPER,"
January 1 Wind and Wildfire Event Summary - A potent upper level trough affected much of the Southern Plains on New Year's Day. The trough resulted in widespread high winds over the region, where intense short-term drought conditions existed. The wind combined with the exceptionally dry conditions to result in a historic outbreak of wildfires over eastern New Mexico, Texas, and Oklahoma.

High and frequently severe winds began to blow over the west Texas South Plains by late morning. These winds persisted through the mid afternoon hours, and resulted in widespread blowing dust and one injury. At least a dozen wind-driven wildfires were sparked over the South Plains. Four of the wildfires were significant, and resulted in the loss of property and three injuries. The winds and fires on the 1st combined to result in four injuries and estimated property losses that exceeded $350,000 .",A large wildfire near Levelland burned two mobile homes and injured fire fighters. Two firemen were hospitalized due to minor burn injuries and smoke inhalation.
200601,1,1430,200601,1,1630,203290,5486118,TEXAS,48,2006,January  ,Wildfire,Z,39,YOAKUM,LUB,2006-01-01 14:30:00,CST,2006-01-01 16:30:00,0,0,0,0,0,0,OTHER FEDERAL AGENCY,"
January 1 Wind and Wildfire Event Summary - A potent upper level trough affected much of the Southern Plains on New Year's Day. The trough resulted in widespread high winds over the region, where intense short-term drought conditions existed. The wind combined with the exceptionally dry conditions to result in a historic outbreak of wildfires over eastern New Mexico, Texas, and Oklahoma.

High and frequently severe winds began to blow over the west Texas South Plains by late morning. These winds persisted through the mid afternoon hours, and resulted in widespread blowing dust and one injury. At least a dozen wind-driven wildfires were sparked over the South Plains. Four of the wildfires were significant, and resulted in the loss of property and three injuries. The winds and fires on the 1st combined to result in four injuries and estimated property losses that exceeded $350,000 .","A wildfire that initiated near Tatum, New Mexico, burned several thousand acres of rangeland and threatened structures as it spread across the Texas/New Mexico state-line into Yoakum County near Bronco. The fire was contained before doing significant damage in Yoakum County, but one rural residence was evacuated."
200601,1,1500,200601,1,2300,203890,5491371,OKLAHOMA,40,2006,January  ,Wildfire,Z,70,MUSKOGEE,TSA,2006-01-01 15:00:00,CST,2006-01-01 23:00:00,0,0,0,0,500K,,NEWSPAPER,"Grass fires fueled by high winds raced across an estimated 16,000 acres southwest of Muskogee destroying four homes, several barns and a lot of hay.",
200601,1,1500,200601,1,2200,203985,5492844,TEXAS,48,2006,January  ,Wildfire,Z,116,PALO PINTO,FWD,2006-01-01 15:00:00,CST,2006-01-01 22:00:00,2,0,0,0,800K,,NEWSPAPER,,"A grass fire which began near the Mineral Wells airport burned 13 structures, including five homes.  The fire grew to cover 1,800 acres.  One firefighter suffered second-degree burns and another smoke inhalation."
200601,1,1500,200601,1,2200,203891,5491372,OKLAHOMA,40,2006,January  ,Wildfire,Z,60,TULSA,TSA,2006-01-01 15:00:00,CST,2006-01-01 22:00:00,0,0,0,0,,,NEWSPAPER,"A large grass fire occurred near 111th Street South and Highway 75.  A neighborhood had to be evacuated, but no homes were damaged.",
200601,1,1800,200601,2,1200,203985,5492846,TEXAS,48,2006,January  ,Wildfire,Z,129,EASTLAND,FWD,2006-01-01 18:00:00,CST,2006-01-02 12:00:00,0,0,0,0,5M,,NEWSPAPER,,"A grass fire burned more than 35,000 acres in the southeastern part of the county and forced evacuations of the nearby towns of Carbon, Gorman, and Desdemona.  The community of Kokomo was essentially demolished.  Thirty-six buildings, including homes, were destroyed.  Numerous livestock were lost in the fire.  The fire was thirty-five miles long."
200601,1,1800,200601,1,2300,203985,5492845,TEXAS,48,2006,January  ,Wildfire,Z,91,MONTAGUE,FWD,2006-01-01 18:00:00,CST,2006-01-01 23:00:00,4,0,0,0,5M,,NEWSPAPER,,"Several devastating wild fires erupted across north Texas due to low humidities, strong winds, and the ongoing drought.   In Montague County, a 17-mile long fire burned between Ringgold and Nocona, destroying forty homes.  Two firefighters and two civilians were injured.  A grass fire which began in Palo Pinto County near the Mineral Wells Airport burned 13 structures, including 5 homes.  The fire grew to cover 1,800 acres.  One firefighter suffered second-degree burns and another smoke inhalation.  A grass fire burned more than 35,000 acres in the southeastern part of Eastland county and forced evacuations of the nearby towns of Carbon, Gorman, and Desdemona.  The community of Kokomo essentially burned to the ground.  Thirty-six buildings, including homes, were destroyed.  Numerous livestock were lost in the fire.  The fire was 35 miles long."
200601,1,1800,200601,1,2300,203889,5491370,OKLAHOMA,40,2006,January  ,Wildfire,Z,65,OKFUSKEE,TSA,2006-01-01 18:00:00,CST,2006-01-01 23:00:00,0,0,0,0,,,NEWSPAPER,A large wildfire burned about three miles north of Okemah Lake Road.  The fire threatened homes and several fire departments responded.,
200601,2,1400,200601,2,1800,203986,5492933,TEXAS,48,2006,January  ,Wildfire,Z,130,ERATH,FWD,2006-01-02 14:00:00,CST,2006-01-02 18:00:00,0,0,0,0,750K,,NEWSPAPER,,A grass fire destroyed 6 houses in the town of Huckabay.
200601,3,1100,200601,3,1800,203888,5491369,OKLAHOMA,40,2006,January  ,Wildfire,Z,64,CREEK,TSA,2006-01-03 11:00:00,CST,2006-01-03 18:00:00,0,0,0,0,100K,,NEWSPAPER,"A grass fire that swept across Shamrock in southwest Creek county destroyed an abandoned school, a vacant home and damaged two other residences.",
200601,3,1215,200601,3,1800,203063,5488204,HAWAII,15,2006,January  ,Wildfire,Z,2,KAUAI WINDWARD,HFO,2006-01-03 12:15:00,HST,2006-01-03 18:00:00,0,0,0,0,,,NEWSPAPER,"A fire burned 200 acres of mainly brush near Hanamaulu, north of Lihue, on the isle of Kauai.  The blaze would have threatened an elementary school and several homes if it had not been contained when it was.  One small business was evacuated near the fire as a precaution.  Smoke and debris forced officials to close Kapule Highway for a several hours in Hanamaulu, which snarled traffic to as far north as Wailua and as far south as Lihue.  The cause of the fire was unknown.  There were no serious injuries or property damage reported.",
200601,3,1300,200601,4,300,203628,5486448,OKLAHOMA,40,2006,January  ,Wildfire,Z,3,BEAVER,AMA,2006-01-03 13:00:00,CST,2006-01-04 03:00:00,0,0,0,0,,,NEWSPAPER,Strong winds...low relative humidities and very dry fuels combined to produce two wildfires in the eastern Oklahoma panhandle during the early afternoon hours and continued until after midnight. The first wildfire was reported three and one-quarter miles west of Clearlake and the second wildfire occurred near the Beaver River or six miles east of Beaver. Several structures were threatened at the Clearlake fire. A total of around fourteen thousand acres were burned.,
200601,3,1600,200601,3,2330,203984,5492843,TEXAS,48,2006,January  ,Wildfire,Z,102,WISE,FWD,2006-01-03 16:00:00,CST,2006-01-03 23:30:00,0,0,0,0,80K,,NEWSPAPER,,"A grass fire started near Boonsville, burning 5,000 acres and 6 non-residential structures."
200601,3,1900,200601,4,1730,203064,5488205,HAWAII,15,2006,January  ,Wildfire,Z,6,WAIANAE COAST,HFO,2006-01-03 19:00:00,HST,2006-01-04 17:30:00,0,0,0,0,,,NEWSPAPER,"A fire consumed about 500 acres of brush and grass near Kili Drive in Makaha on the island of Oahu.  The fire scorched a remote, mile-long, area on the west side of Makaha Valley.  Officials suspected that the blaze had been deliberately set.  There were no reports of serious property damage or injuries.",
200601,5,1600,200601,5,2300,203983,5492841,TEXAS,48,2006,January  ,Wildfire,Z,117,PARKER,FWD,2006-01-05 16:00:00,CST,2006-01-05 23:00:00,0,0,0,0,8K,,NEWSPAPER,,"A grass fire burned 30 acres along Old Agnes Road off Texas 199, about eight miles west of Springtown.  Several bales of hay and fences were destroyed.  Another fire in Hunt County destroyed one home and burned 300 acres."
200601,5,1800,200601,5,2300,203983,5492842,TEXAS,48,2006,January  ,Wildfire,Z,105,HUNT,FWD,2006-01-05 18:00:00,CST,2006-01-05 23:00:00,0,0,0,0,130K,,NEWSPAPER,,A grass fire in Hunt County destroyed one home and burned 300 acres.
200601,7,1100,200601,7,1700,203855,5486467,MISSOURI,29,2006,January  ,Wildfire,Z,93,NEWTON,SGF,2006-01-07 11:00:00,CST,2006-01-07 17:00:00,0,0,0,0,,,LAW ENFORCEMENT,,Several Newton County fire departments and other local agencies battled several timber and grass fires throughout rural sections of the county on a day typical of red flag conditions.
200601,7,1100,200601,7,1700,203856,5486468,MISSOURI,29,2006,January  ,Wildfire,Z,88,JASPER,SGF,2006-01-07 11:00:00,CST,2006-01-07 17:00:00,0,0,0,0,,,LAW ENFORCEMENT,,"Several wildfires were ignited across rural sections of Jasper County.  Weather conditions were conducive to wildfire behavior including strong winds, drought impacted vegetation, and a dry airmass."
200601,7,1640,200601,12,1800,208233,5503726,COLORADO,8,2006,January  ,Wildfire,Z,88,TRINIDAD VICINITY / LOWER HUERFANO RIVER BASIN & WESTERN LAS ANIMAS COUNTY BELOW 7500 FT,PUB,2006-01-07 16:40:00,MST,2006-01-12 18:00:00,0,0,0,0,1M,,PARK/FOREST SERVICE,"The Mauricio Canyon Fire started with a burning of tree piles on private land.  It eventually consumed around 4500 acres, burning 5 homes and 10 other structures.  Over 100 people were evacuated during the event.  The wildfire occurred on the Huerfano - Las Animas County line, approximately 5 to 10 miles west and northwest of Aguilar.",
200601,7,1640,200601,12,1800,208233,5503727,COLORADO,8,2006,January  ,Wildfire,Z,87,WALSENBURG VICINITY / UPPER HUERFANO RIVER BASIN BELOW 7500 FT,PUB,2006-01-07 16:40:00,MST,2006-01-12 18:00:00,0,0,0,0,,,PARK/FOREST SERVICE,"The Mauricio Canyon Fire started with a burning of tree piles on private land.  It eventually consumed around 4500 acres, burning 5 homes and 10 other structures.  Over 100 people were evacuated during the event.  The wildfire occurred on the Huerfano - Las Animas County line, approximately 5 to 10 miles west and northwest of Aguilar.",
200601,8,30,200601,8,2345,203896,5491377,OKLAHOMA,40,2006,January  ,Wildfire,Z,71,MCINTOSH,TSA,2006-01-08 00:30:00,CST,2006-01-08 23:45:00,0,0,0,0,50K,,NEWSPAPER,"A fire occurred along McAnally Road and spread to the east to behind the Pixie Woods area.  The fire consumed almost 7,000 acres and four barns were destroyed.",
200601,8,1200,200601,9,1200,203088,5488595,ARKANSAS,5,2006,January  ,Wildfire,Z,74,ASHLEY,JAN,2006-01-08 12:00:00,CST,2006-01-09 12:00:00,0,0,0,0,800K,1M,NEWSPAPER,,"A large wildfire burned Sunday afternoon and evening across Central Ashley county. This fire burned nearly 6000 acres just southeast of Hamburg. Four homes were burned along with two camping trailers and 2 outbuildings. This large fire caused the closing of Highway 8 for a period of time. Another wildfire developed south of Crossett. This fire actually started in Louisiana and moved into Arkansas. This fire burned nearly 2000 acres.

These wildfires were the product of several months of extremely dry weather across the region. The combination of prolonged dry conditions and dead/dormant vegetation lead to high fire fuel across the region. As the fires began, low relative humidity values and strong southwest winds on Sunday, January 8th, promoted the rapid spreading of any fire."
200601,8,1400,200601,8,1900,203225,5489137,KENTUCKY,21,2006,January  ,Wildfire,Z,5,MCCRACKEN,PAH,2006-01-08 14:00:00,CST,2006-01-08 19:00:00,0,0,0,0,,,NEWSPAPER,,"Windy and dry conditions fanned the flames of a 300-acre grass and brush fire in western McCracken County, near Grahamville. The fire began near Kentucky Highway 358 in the West Kentucky Wildlife Management Area and spread quickly north-northeast toward the Ohio River. All county fire departments in McCracken County were summoned to the scene, along with a couple departments from Ballard County. Firefighters with the State of Kentucky and the Tennessee Valley Authority assisted. McCracken County instituted a countywide burn ban immediately after the fire."
200601,12,1430,200601,12,1600,203291,5486119,TEXAS,48,2006,January  ,Wildfire,Z,22,CASTRO,LUB,2006-01-12 14:30:00,CST,2006-01-12 16:00:00,0,0,0,0,150K,0,LAW ENFORCEMENT,"
A series of at least six wildfires charred portions of the extreme southern Texas Panhandle and the South Plains of west Texas on the 12th. Strong westerly winds and extremely low relative humidity values combined with parched fuels and the ongoing short-term drought to result in a very high fire danger. In addition, an advancing cold front interacted with several of the fires, changing the direction of fire propagation and spread. Two wildfires became significant and destroyed property, including one fire that threatened the city of Dimmitt (Castro County). Total losses were estimated at $200,000.","
A large wildfire ignited near U.S. Highway 385 just north of Dimmitt on the afternoon of the 12th. A frontal passage caused a westerly to northerly wind shift that rapidly changed the fire's direction of growth and spread. The fire destroyed three abandoned structures on the northwest side of the city. Resources from surrounding counties as well as the Texas Forest Service were utilized to battle the blaze. Two forest service air tankers provided airdrops and managed to contain the fire before it spread into the city. This undoubtedly averted extensive damage to homes and businesses.

A second large wildfire was reported to be burning out of control just west of Matador around 15:00 CST on the 12th. This fire destroyed at least one structure. No injuries were reported."
200601,12,1500,200601,12,1630,203291,5486120,TEXAS,48,2006,January  ,Wildfire,Z,31,MOTLEY,LUB,2006-01-12 15:00:00,CST,2006-01-12 16:30:00,0,0,0,0,50K,0,FIRE DEPT/RESCUE SQUAD,"
A series of at least six wildfires charred portions of the extreme southern Texas Panhandle and the South Plains of west Texas on the 12th. Strong westerly winds and extremely low relative humidity values combined with parched fuels and the ongoing short-term drought to result in a very high fire danger. In addition, an advancing cold front interacted with several of the fires, changing the direction of fire propagation and spread. Two wildfires became significant and destroyed property, including one fire that threatened the city of Dimmitt (Castro County). Total losses were estimated at $200,000.",A wildfire burned out of control just west of Matador during the afternoon hours of the 12th. The fire destroyed at least one structure. No injuries were reported.
200601,13,830,200601,13,1300,203987,5492934,TEXAS,48,2006,January  ,Wildfire,Z,101,JACK,FWD,2006-01-13 08:30:00,CST,2006-01-13 13:00:00,0,0,0,0,,,FIRE DEPT/RESCUE SQUAD,,At least four thousand acres burned in Jack county due to a grass fire.  No buildings were reportedly damaged.
