BEGIN_YEARMONTH,BEGIN_DAY,BEGIN_TIME,END_YEARMONTH,END_DAY,END_TIME,EPISODE_ID,EVENT_ID,STATE,STATE_FIPS,YEAR,MONTH_NAME,EVENT_TYPE,CZ_TYPE,CZ_FIPS,CZ_NAME,WFO,BEGIN_DATE_TIME,CZ_TIMEZONE,END_DATE_TIME,INJURIES_DIRECT,INJURIES_INDIRECT,DEATHS_DIRECT,DEATHS_INDIRECT,DAMAGE_PROPERTY,DAMAGE_CROPS,SOURCE,EPISODE_NARRATIVE,EVENT_NARRATIVE
200603,26,1200,200603,26,2100,206214,5499195,OKLAHOMA,40,2006,March    ,Wildfire,Z,66,OKMULGEE,TSA,2006-03-26 12:00:00,CST,2006-03-26 21:00:00,0,0,0,0,25K,,NEWSPAPER,"Despite the recent rains, vegetation remained dormant and dry, which helped promote the spread of wildfire on the 26th when warm and windy conditions developed across the area.  A number of fires were started and quickly grew out of control during the afternoon.  The most notable fires occurred near Bristow in Creek County, near Muskogee in Muskogee County, near Scipio in Pittsburg County (a house was damaged in this fire), across western Wagoner County, and across portions of Okfuskee and Okmulgee Counties.",
200603,26,1200,200603,26,2100,206214,5499194,OKLAHOMA,40,2006,March    ,Wildfire,Z,65,OKFUSKEE,TSA,2006-03-26 12:00:00,CST,2006-03-26 21:00:00,0,0,0,0,,,NEWSPAPER,"Despite the recent rains, vegetation remained dormant and dry, which helped promote the spread of wildfire on the 26th when warm and windy conditions developed across the area.  A number of fires were started and quickly grew out of control during the afternoon.  The most notable fires occurred near Bristow in Creek County, near Muskogee in Muskogee County, near Scipio in Pittsburg County (a house was damaged in this fire), across western Wagoner County, and across portions of Okfuskee and Okmulgee Counties.",
200603,26,1200,200603,26,2100,206214,5499192,OKLAHOMA,40,2006,March    ,Wildfire,Z,73,PITTSBURG,TSA,2006-03-26 12:00:00,CST,2006-03-26 21:00:00,0,0,0,0,,,NEWSPAPER,"Despite the recent rains, vegetation remained dormant and dry, which helped promote the spread of wildfire on the 26th when warm and windy conditions developed across the area.  A number of fires were started and quickly grew out of control during the afternoon.  The most notable fires occurred near Bristow in Creek County, near Muskogee in Muskogee County, near Scipio in Pittsburg County (a house was damaged in this fire), across western Wagoner County, and across portions of Okfuskee and Okmulgee Counties.",
200603,26,1200,200603,26,2100,206214,5499191,OKLAHOMA,40,2006,March    ,Wildfire,Z,70,MUSKOGEE,TSA,2006-03-26 12:00:00,CST,2006-03-26 21:00:00,0,0,0,0,,,NEWSPAPER,"Despite the recent rains, vegetation remained dormant and dry, which helped promote the spread of wildfire on the 26th when warm and windy conditions developed across the area.  A number of fires were started and quickly grew out of control during the afternoon.  The most notable fires occurred near Bristow in Creek County, near Muskogee in Muskogee County, near Scipio in Pittsburg County (a house was damaged in this fire), across western Wagoner County, and across portions of Okfuskee and Okmulgee Counties.",
200603,30,900,200603,30,1800,205822,5494387,MARYLAND,24,2006,March    ,Wildfire,Z,8,CECIL,PHI,2006-03-30 09:00:00,EST,2006-03-30 18:00:00,0,0,0,0,,,NEWSPAPER,"A wildfire consumed more than two acres of woodland near Elk Neck State Forest. In the month of March 35 fires consumed 35 acres of woodland in Cecil County. Unseasonably dry weather prevailed throughout the state of Maryland and led to 366 wildfires during the month of March, triple the 20 year average for the month. On the 31st the Maryland Department of Natural Resources imposed an outdoor burning in the state. Campfires, bonfires and fireworks were included in the ban. Leaf, brush, grass and trash burning were also prohibited. All burning permits in Cecil County were suspended indefinitely. 

The unseasonably dry weather has caused some Maryland crops to be behind schedule. Dry field conditions might cause delayed plantings. The low flow in the Cesapeake Bay and higher salinity values will leave oysters vulnerable to diseases. It would also damage some underwater grasses and was expected to increase the number of jellyfish. March 2006 was the driest March on record (112 years) in Maryland. The statewide average precipitation was 0.34 inches, 3.75 inches drier than normal.",
200603,30,1100,200603,30,1500,205820,5494385,PENNSYLVANIA,42,2006,March    ,Wildfire,Z,69,BUCKS,PHI,2006-03-30 11:00:00,EST,2006-03-30 15:00:00,0,0,0,0,100K,,NEWSPAPER,"A brush fire up the side of a hill in Kintnersville (Nockamixon Township) damaged two acres, the side of one house and a garage. The wildfire started near the intersection of Pennsylvania State Routes 611 and 32. Nearby Durham Township issued an outside burning ban. Since March 8th, there have been 40 wildfires in southeastern Pennsylvania. The largest brush fire in eastern Pennsylvania in the month occurred on the 17th in Northampton County when 29 acres were consumed. There was no structural damage.

March 2006 was the fifth driest March on record (112 years) in the state of Pennsylvania. The statewide precipitation average was 1.59 inches, 1.82 inches drier than normal. Drier conditions occurred in the eastren part of the state. On a countywide average, March monthly precipitation totals ranged from 0.6 inches in Chester County to 1.2 inches in Carbon, Monroe and Philadelphia Counties. March 2006 tied March 1981 as the driest March on record at the Lehigh Valley International Airport. The monthly precipitation total of 0.92 inches was 2.64 inches drier than normal. It was the fourth driest March on record at the Philadelphia International Airport. The monthly precipitation total of 0.91 inches was 2.90 inches drier than normal. In Reading (Berks County), the March monthly precipitation total was 0.62 inches, 2.98 inches drier than normal. In Mount Pocono (Monroe County), the March precipitation total was 0.99 inches, 3.04 inches drier than normal.",
200603,30,1149,200603,30,1700,206670,5496264,TEXAS,48,2006,March    ,Wildfire,Z,12,POTTER,AMA,2006-03-30 11:49:00,CST,2006-03-30 17:00:00,0,0,0,0,590K,,FIRE DEPT/RESCUE SQUAD,A wildfire three and a half miles northeast of Amarillo destroyed fourteen homes...numerous vehicles...and four outbuildings. The wildfire burned seven hundred acres and there were no reports of injuries.,
200603,30,1500,200603,30,1500,208171,5499768,KANSAS,20,2006,March    ,Wildfire,Z,67,RENO,ICT,2006-03-30 15:00:00,CST,2006-03-30 15:00:00,0,0,0,0,1.1M,,NEWSPAPER,,"A wildfire burned 5,400 acres east of the Hutchinson Airport, near the intersection of 17th Avenue and Obee Road.  It was likely started by a lightning strike from thunderstorms early that afternoon.  300-400 people were evacuated from a 21 square-mile area between 3-10 pm.  The fire was well contained by 8 pm, but was not fully extinguished until late Saturday afternoon, April 1st.  The fire destroyed 5 houses and 20 outbuildings, and numerous campers, automobiles and farm implements were damaged or destroyed.  Most of the damaged large structures were located along 17th Avenue.  Thankfully, no one was injured."
200603,31,1535,200603,31,1900,206671,5496265,TEXAS,48,2006,March    ,Wildfire,Z,12,POTTER,AMA,2006-03-31 15:35:00,CST,2006-03-31 19:00:00,0,0,0,0,,,FIRE DEPT/RESCUE SQUAD,A wildfire nine miles northeast of Amarillo burned three hundred acres...however there were no reports of structure damage or injuries.,
200604,2,1330,200604,2,2300,208530,5503567,OKLAHOMA,40,2006,April    ,Wildfire,Z,2,TEXAS,AMA,2006-04-02 13:30:00,CST,2006-04-02 23:00:00,0,0,0,0,18K,,NEWSPAPER,A wildfire six miles east of Hardesty burned six hundred acres and destroyed fences. Also...power poles were singed. There were no reports of structural damage or injuries.,
200604,3,1200,200604,3,1200,208207,5503516,PENNSYLVANIA,42,2006,April    ,Wildfire,Z,60,BERKS,PHI,2006-04-03 12:00:00,EST,2006-04-03 12:00:00,0,0,0,0,0,,NEWSPAPER,"During the afternoon of the 3rd, a resident in Douglass Township on Hill Road was burning brush when the fire spread to nearby brush. The ensuing fire scorched 3 acres before it was brought under control in 2 hours. The flames came within 100 to 200 yards of 5 homes, however no injuries were reported.",
200604,4,1135,200604,5,2300,208531,5503568,TEXAS,48,2006,April    ,Wildfire,Z,15,WHEELER,AMA,2006-04-04 11:35:00,CST,2006-04-05 23:00:00,0,0,0,0,,,FIRE DEPT/RESCUE SQUAD,A wildfire four miles southeast of Allison burned three thousand six hundred acres. There were no reports of structural damage or injuries.,
200604,6,1225,200604,7,1600,208539,5503654,TEXAS,48,2006,April    ,Wildfire,Z,15,WHEELER,AMA,2006-04-06 12:25:00,CST,2006-04-07 16:00:00,1,0,0,0,6K,,FIRE DEPT/RESCUE SQUAD,A wildfire fifteen miles northeast of Wheeler burned one thousand five hundred acres. One outbuilding was destroyed and there was one report of an injury.,
200604,6,1230,200604,7,1700,208538,5503653,TEXAS,48,2006,April    ,Wildfire,Z,11,OLDHAM,AMA,2006-04-06 12:30:00,CST,2006-04-07 17:00:00,0,0,0,0,,,FIRE DEPT/RESCUE SQUAD,A wildfire nine miles west-northwest of Wildorado burned six hundred and fifty acres. There were no reports of structural damage or injuries.,
200604,6,1300,200604,6,2359,207363,5501198,TEXAS,48,2006,April    ,Wildfire,Z,52,HOWARD,MAF,2006-04-06 13:00:00,CST,2006-04-06 23:59:00,0,0,0,0,60K,20K,PARK/FOREST SERVICE,,"
Hot temperatures, relative humidity values below 15 percent, and high winds supported rapid wildfire spread across the Midland county warning area.  Fires occurred in Lea County in southeastern New Mexico and in Gaines, Crane, and Howard counties in west Texas.  The largest of these fires was a complex that occurred in Howard County near the community of Forsan caused by downed transmission lines.  A fire just outside Forsan grew to 10,000 acres while a second fire several miles south of Forsan grew to about 2,000 acres.  The Texas Forest Service assisted local firefighting agencies in extinguishing these fires and others around the area with resources that had been stationed across west Texas since March."
200604,6,1300,200604,7,1700,208535,5503650,TEXAS,48,2006,April    ,Wildfire,Z,12,POTTER,AMA,2006-04-06 13:00:00,CST,2006-04-07 17:00:00,0,0,0,0,480K,,FIRE DEPT/RESCUE SQUAD,A wildfire three and a half miles north-northeast of Amarillo burned four hundred acres. Although there were no reports of injuries...eight homes were destroyed.,
200604,6,1300,200604,9,1700,208534,5503649,TEXAS,48,2006,April    ,Wildfire,Z,12,POTTER,AMA,2006-04-06 13:00:00,CST,2006-04-09 17:00:00,0,0,0,0,,,FIRE DEPT/RESCUE SQUAD,A wildfire twenty-five miles north-northwest of Amarillo burned a total of twenty-two thousand four hundred and thirty-seven acres. There were no reports of injuries or structural damage.,
200604,6,1300,200604,7,1700,208533,5503570,TEXAS,48,2006,April    ,Wildfire,Z,14,GRAY,AMA,2006-04-06 13:00:00,CST,2006-04-07 17:00:00,1,0,0,0,,,FIRE DEPT/RESCUE SQUAD,A wildfire four miles west of Lefors burned eight thousand acres and injured at least one firefighter. There were no reports of any structures being damaged.,
200604,6,1330,200604,6,1700,206724,5496852,TEXAS,48,2006,April    ,Wildfire,Z,28,LAMB,LUB,2006-04-06 13:30:00,CST,2006-04-06 17:00:00,0,0,0,0,100K,0,BROADCAST MEDIA,"
April 6 High Wind and Wilfire Event Summary:  A vigorous storm system ejected eastward from the Rocky Mountains and resulted in widespread strong to severe winds and blowing dust over much of west Texas. The winds additionally contributed to yet another regional outbreak of destructive wildfires over portions of the drought-stricken states of New Mexico, Texas, and Oklahoma. Severe winds were common over the South Plains region with minor damage reported. At least six wildfires ignited in the winds across the South Plains and the extreme southern Texas Panhandle. One fire became a significant wind-driven wildfire that destroyed a single family home in Lamb County. Total damages from wind and fire were estimated near $200,000. No injuries were reported.","Damaging winds downed lines at a utility company sub-station west of Earth in northwestern Lamb County during the early afternoon hours. By 13:30 CST, the downed lines had sparked a dangerous wind driven wildfire that raged through several hundred acres of grasslands. Local authorities were forced to close a portion of Farm to Market Road 303 near Earth due to the fire and reduced visibilities from smoke. One home was destroyed in the blaze. No injuries were reported."
200604,6,1400,200604,7,1700,208532,5503569,TEXAS,48,2006,April    ,Wildfire,Z,12,POTTER,AMA,2006-04-06 14:00:00,CST,2006-04-07 17:00:00,0,0,0,0,900K,,FIRE DEPT/RESCUE SQUAD,A wildfire five miles northeast of Amarillo burned one thousand eight hundred acres. The wildfire destroyed fourteen homes along with four outbuildings. There were no reports of injuries.,
200604,6,1430,200604,7,2000,208536,5503651,TEXAS,48,2006,April    ,Wildfire,Z,19,DONLEY,AMA,2006-04-06 14:30:00,CST,2006-04-07 20:00:00,0,0,0,0,14K,,FIRE DEPT/RESCUE SQUAD,A wildfire eight miles north of Clarendon burned five thousand acres and destroyed two outbuildings. There were no reports of injuries.,
200604,6,1940,200604,7,2300,208537,5503652,TEXAS,48,2006,April    ,Wildfire,Z,16,DEAF SMITH,AMA,2006-04-06 19:40:00,CST,2006-04-07 23:00:00,0,0,0,0,,,FIRE DEPT/RESCUE SQUAD,A wildfire thirty-three miles northwest of Hereford burned three thousand acres. There were no reports of structural damage or injuries.,
200604,7,800,200604,9,1700,208540,5503655,TEXAS,48,2006,April    ,Wildfire,Z,13,CARSON,AMA,2006-04-07 08:00:00,CST,2006-04-09 17:00:00,0,0,0,0,,,FIRE DEPT/RESCUE SQUAD,A wildfire seventeen miles northwest of Panhandle burned ten thousand acres. There were no reports of damage to structures or injuries.,
200604,10,900,200604,14,0,208239,5503733,WYOMING,56,2006,April    ,Wildfire,Z,18,LANDER FOOTHILLS,RIW,2006-04-10 09:00:00,MST,2006-04-14 00:00:00,0,0,0,0,1M,,PARK/FOREST SERVICE,"A prescribed fire originally lit on April 9th burned out of control on April 10th, destroying four summer cabins/homes and a pick-up camper in the Homestead Park #2 subdivision located eight miles southwest of Lander.  The escaped fire burned 188 acres, of which 123 were on the Shoshone National Forest, five on BLM land, and 60 on private land.  The estimated cost of fighting the fire was 333 thousand dollars.  Combined with the estimated value of the four structures, the total cost of the wildfire was estimated at one million dollars.",
200604,10,1130,200604,11,1200,208541,5503656,TEXAS,48,2006,April    ,Wildfire,Z,15,WHEELER,AMA,2006-04-10 11:30:00,CST,2006-04-11 12:00:00,0,0,0,0,5K,,FIRE DEPT/RESCUE SQUAD,A wildfire five miles northeast of Wheeler burned two thousand acres. There was one outbuilding destroyed...however there were no reports of any injuries.,
200604,11,1200,200604,11,1200,208206,5503515,NEW JERSEY,34,2006,April    ,Wildfire,Z,17,GLOUCESTER,PHI,2006-04-11 12:00:00,EST,2006-04-11 12:00:00,0,0,0,0,0,,NEWSPAPER,"A fire during the afternoon hours of the 11th burned 75 acres in the area of Mantua and Dupont Avenues in the Paulsboro region. The fire was located on marshland comprised of dried reeds. Nearby railroad cars were potentially threatened and one of the cars had power steering in it, while another railcar was full of brake fluid. Firefighters worked to keep the flames away from the railcars, which were within a couple hundred feet of homes. Firefighters extinguished the fire before it reached the railcars and homes, and no one was injured. To fight the fire, which burned for a good 2 hours, a boat and airplane were utilized.",
200604,11,1200,200604,13,1700,208544,5503659,TEXAS,48,2006,April    ,Wildfire,Z,10,HEMPHILL,AMA,2006-04-11 12:00:00,CST,2006-04-13 17:00:00,2,0,0,0,,90M,FIRE DEPT/RESCUE SQUAD,A wildfire ten miles north of Canadian burned eighteen thousand acres and destroyed crops. There were several homes threatened by the wildfire...however no homes were lost. There were two injuries reported.,
200604,11,1300,200604,13,1700,208543,5503658,TEXAS,48,2006,April    ,Wildfire,Z,15,WHEELER,AMA,2006-04-11 13:00:00,CST,2006-04-13 17:00:00,0,0,0,0,,300K,FIRE DEPT/RESCUE SQUAD,A wildfire three miles northwest of Mobeetie burned six hundred acres and destroyed crops. There were no reports of injuries.,
200604,11,1335,200604,13,1700,208542,5503657,TEXAS,48,2006,April    ,Wildfire,Z,15,WHEELER,AMA,2006-04-11 13:35:00,CST,2006-04-13 17:00:00,0,0,0,0,,2M,FIRE DEPT/RESCUE SQUAD,A wildfire eighteen miles south of Mobeetie burned four thousand acres and destroyed crops. There were no reports of any injuries.,
200604,13,1200,200604,13,1800,216727,5522367,INDIANA,18,2006,April    ,Wildfire,Z,82,PIKE,PAH,2006-04-13 12:00:00,CST,2006-04-13 18:00:00,0,0,0,0,,,OTHER FEDERAL AGENCY,,A wildfire burned 365 acres between Winslow and Campbelltown near State Route 56.
200604,13,1300,200604,15,1700,207640,5501389,KENTUCKY,21,2006,April    ,Wildfire,Z,12,TRIGG,PAH,2006-04-13 13:00:00,CST,2006-04-15 17:00:00,0,0,0,0,,,BROADCAST MEDIA,,"A large wildfire on the Land-Between-The-Lakes National Recreation Area burned 1871 acres. The fire started near the Tennessee state line, about ten miles south of Golden Pond, which is along U.S. Highway 68. No injuries or structural damage were reported."
200604,14,1230,200604,20,1400,208259,5504043,VIRGINIA,51,2006,April    ,Wildfire,Z,32,PATRICK,RNK,2006-04-14 12:30:00,EST,2006-04-20 14:00:00,0,0,0,0,3.9M,,EMERGENCY MANAGER,"During the early afternoon of April 14th, 2006 a dissipating complex of thunderstorms moved into southwest Virginia from West Virginia. Lightning from one of the associated thunderstorms started a wildfire on Bull Mountain in central Patrick Co. Virginia. Due to dry insitu conditions, the fire grew to ultimately consume nearly 4000 forest acres of both state and private lands.  Also destroyed were 3 homes, 6 structures, and a variety of personal property.   There was a mandatory evacuation of 40 families with an additional 35 families recommended to evacuate, and many roads leading to the fire scene were closed by local officials.  The fire prompted a declartion of a State of Emergency by the Governor for Patrick Co. Va.

The only injury was an indirectly related to the fire when a firefighter sprained an ankle.",
200604,14,1430,200604,15,1700,208545,5503660,TEXAS,48,2006,April    ,Wildfire,Z,14,GRAY,AMA,2006-04-14 14:30:00,CST,2006-04-15 17:00:00,0,0,0,0,,,FIRE DEPT/RESCUE SQUAD,A wildfire eight miles west-northwest of Pampa burned one thousand five hundred acres. There were no reports of structural damage or injuries.,
200604,15,930,200604,15,1300,206728,5496275,TEXAS,48,2006,April    ,Wildfire,Z,34,HOCKLEY,LUB,2006-04-15 09:30:00,CST,2006-04-15 13:00:00,3,0,0,0,100K,0,BROADCAST MEDIA,"
April 15 High Wind and Wildfire Event Summary:  Another potent spring-time storm system moved over the Southern Plains of the U.S. on the 15th and resulted in strong to occasionally severe westerly winds over much of the region. The winds followed several consecutive days of record high temperatures. This combined with ongoing drought conditions to create an extremely critical fire weather situation over a large part of the Southern High Plains. A large wildfire was ignited by downed power lines in Hockley County. The fire destroyed one residence and injured three people. Two of the injured were fire fighters engaged in battling the blaze. The winds were indirectly responsible for another fire that destroyed a residence in Lubbock County where a large outdoor cooker was blown over. Damage estimates for the event total $250,000.","
Damaging winds downed power lines near Levelland during the morning hours of the 15th. The downed lines sparked a dangerous wind-driven wildfire that scorched a path one half mile wide and five miles in length through the landscape south of the city. The 1,300 acre fire destroyed a trailer home. One resident was evacuated from the area and suffered smoke inhalation related injuries. Two firefighters additionally received minor injuries while battling the blaze."
200604,15,1400,200604,16,1700,208547,5503662,TEXAS,48,2006,April    ,Wildfire,Z,17,RANDALL,AMA,2006-04-15 14:00:00,CST,2006-04-16 17:00:00,0,0,0,0,180K,,FIRE DEPT/RESCUE SQUAD,A wildfire nine miles southwest of Amarillo burned seventy-five acres. The wildfire destroyed one mobile home...five outbuildings...and three vehicles. There were no reports of injuries.,
200604,15,1400,200604,17,2100,208546,5503661,TEXAS,48,2006,April    ,Wildfire,Z,19,DONLEY,AMA,2006-04-15 14:00:00,CST,2006-04-17 21:00:00,0,0,0,0,10K,,FIRE DEPT/RESCUE SQUAD,A wildfire six miles south-southeast of Clarendon burned two thousand two hundred and sixty acres. Fences were destroyed...however there were no reports of structural damage or injuries.,
200604,15,1530,200604,17,2300,208548,5503663,TEXAS,48,2006,April    ,Wildfire,Z,19,DONLEY,AMA,2006-04-15 15:30:00,CST,2006-04-17 23:00:00,0,0,0,0,,,FIRE DEPT/RESCUE SQUAD,A wildfire one mile northwest of Clarendon burned eighteen thousand acres...however there were no reports of structural damage or injuries.,
200604,19,1200,200604,19,1200,208208,5503517,PENNSYLVANIA,42,2006,April    ,Wildfire,Z,54,CARBON,PHI,2006-04-19 12:00:00,EST,2006-04-19 12:00:00,0,0,0,0,0,,NEWSPAPER,"During the early afternoon of the 19th, a brush fire in Aquashicola briefly threatened a home. However, the quick response by firefighters from the Aquashicola and Palmerton fire companies kept the blaze contained to underbrush along a steep hill. No injuries were reported. While several communities declared burning bands earlier, a burn ban was issued on April 22nd for all of Carbon County.",
200604,24,1500,200604,24,2300,208549,5503664,TEXAS,48,2006,April    ,Wildfire,Z,17,RANDALL,AMA,2006-04-24 15:00:00,CST,2006-04-24 23:00:00,0,0,0,0,,,FIRE DEPT/RESCUE SQUAD,A wildfire six miles south-southwest of Umbarger on the southwest side of Buffalo Lake National Wildlife Refuge burned three hundred acres. There were no reports of structural damage or injuries.,
200604,25,1515,200604,25,1900,208237,5503731,COLORADO,8,2006,April    ,Wildfire,Z,74,SOUTHERN SANGRE DE CRISTO MOUNTAINS BETWEEN 7500 & 11000 FT,PUB,2006-04-25 15:15:00,MST,2006-04-25 19:00:00,0,0,0,0,,,OTHER FEDERAL AGENCY,A wildfire consumed around 300 acres about 10 miles north northeast of Stonewall in western Las Animas County.  No structures were damaged.,
200604,27,1500,200604,27,1500,208205,5503514,DELAWARE,10,2006,April    ,Wildfire,Z,3,INLAND SUSSEX,PHI,2006-04-27 15:00:00,EST,2006-04-27 15:00:00,1,0,0,0,0,,NEWSPAPER,"The owner of the Shaffer Service Tire Store on Route 1 in Lewes, Delaware was badly injured during the afternoon of the 27th from a brush fire. The owner started a contained fire, however the fire got away from the planned burn circle near a creek. The owner suffered second-degree burns on his chest, hands, arms and right knee. First responders to the fire used buckets to get water from the nearby creek to toss onto the fire.",
200604,30,1200,200604,30,1200,208209,5503518,PENNSYLVANIA,42,2006,April    ,Wildfire,Z,54,CARBON,PHI,2006-04-30 12:00:00,EST,2006-04-30 12:00:00,0,0,0,0,0,,NEWSPAPER,"A brush fire broke out during the early afternoon on the 30th in the Summit Hill area. The fire itself started in the vicinity of a cell tower along a dirt road known as Target Road. The fire encompassed about 10 acres of woods and brush. At the height of the fire, some flames jumped several dirt roads, including Target Road. No injuries were reported as a result of this brush fire. On April 22nd, a burn ban was issued for all of Carbon County.",
200604,30,1220,200604,30,2359,208561,5503789,MICHIGAN,26,2006,April    ,Wildfire,Z,29,OSCODA,APX,2006-04-30 12:20:00,EST,2006-04-30 23:59:00,0,0,0,0,350K,,LAW ENFORCEMENT,"The Hughes Lake Fire started early in the afternoon of April 30th, near the Ogemaw/Oscoda County line, southeast of Hughes Lake.  Southeast winds of 10 to 20 mph pushed the fire quickly to the northwest.  At its peak spread rate late in the afternoon, the fire was moving at two miles per hour, with flames as high as 300 feet tall.  The fire would largely be brought under control on May 1st, with several days of mop-up activities after that.  Please see May 2006 Storm Data for a complete summary of the Hughes Lake Fire.",
